{
  "contract_version": 1,
  "suite": "continue_watching",
  "case_id": "dedupe_same_episode_small_progress_prefers_newer",
  "now_ms": 1739923200000,
  "input": {
    "max_items": 10,
    "candidates": [
      {
        "content_type": "series",
        "content_id": "tt011",
        "episode_key": "s1e1",
        "progress_percent": 50.2,
        "last_updated_ms": 1739923000000
      },
      {
        "content_type": "series",
        "content_id": "tt011",
        "episode_key": "s1e1",
        "progress_percent": 50.0,
        "last_updated_ms": 1739923100000
      }
    ]
  },
  "expected": {
    "items": [
      {
        "content_type": "series",
        "content_id": "tt011",
        "episode_key": "s1e1",
        "progress_percent": 50.0,
        "last_updated_ms": 1739923100000,
        "is_up_next_placeholder": false
      }
    ]
  }
}
